{
  "schemaVersion": "1.0.0",
  "expectedSource": {
    "commit": "aaaaaaaaaaaaaaaaaaaaaaaaaaaaaaaaaaaaaaaa",
    "dirty": false
  },
  "requiredChecks": [
    {
      "id": "unit",
      "environment": {
        "os": "windows",
        "runtime": "node",
        "version": "24.0.0"
      }
    }
  ],
  "runs": []
}
